{
  "type": {
    "id": 1,
    "url": "https://api.seerapi.com/v1/mintmark_type/1/"
  },
  "rarity": {
    "id": 1,
    "url": "https://api.seerapi.com/v1/mintmark_rarity/1/"
  },
  "pet": [
    {
      "id": 1079,
      "url": "https://api.seerapi.com/v1/pet/1079/"
    }
  ],
  "id": 20244,
  "name": "疯狂连锤刻印",
  "desc": "连击次数+1",
  "effect": {
    "effect": 105,
    "arg": 1
  },
  "skill": [
    {
      "id": 12532,
      "url": "https://api.seerapi.com/v1/skill/12532/"
    }
  ],
  "hash": "62024214"
}