{
  "type": {
    "id": 1,
    "url": "https://api.seerapi.com/v1/mintmark_type/1/"
  },
  "rarity": {
    "id": 1,
    "url": "https://api.seerapi.com/v1/mintmark_rarity/1/"
  },
  "pet": [
    {
      "id": 1308,
      "url": "https://api.seerapi.com/v1/pet/1308/"
    }
  ],
  "id": 20329,
  "name": "地魂护体刻印",
  "desc": "回合数+1",
  "effect": {
    "effect": 107,
    "arg": 1
  },
  "skill": [
    {
      "id": 21595,
      "url": "https://api.seerapi.com/v1/skill/21595/"
    }
  ],
  "hash": "54f89604"
}